Movie,Title,Content,Rate,Upvotes,Downvotes,Polarity,Subjectivity
,"Daring, defiant and not perfect","Jacques Audiard continues to show that he is always looking for new things that give him new abilities and with Emilia Pérez he reaches the musical in a strange, but immersive way, which is one of the most hypnotic films of 2024.Presented at Cannes 2024, where it already generated that murmur that invites us to take it into consideration and once you manage to see it, you get the feeling that we are facing a strange combination, but one that becomes addictive like one of those imaginative drugs that take you to strange sensations. Emilia Pérez is a bit of that drug, where the French director offers us a fictional story about identity change, Mexican cartels, rights and healing.The journey that Audiard takes us on has great allies in its leading trio, headed by Zoe Saldana in her best form, who is the true protagonist of the show with a main character that gains strength as we learn everything she hides behind. A Selena Gomez who has the presence of being a megastar and also a very good actress in a supporting role that makes her look like she hasnt been seen for a long time on the big screen. However, the great revelation is Karla Sofía Gascón, who faces with total naturalness a character that means a lot to the actress and her new stage of life. Emilia Pérez is her and she is truly amazing for a charismatic, daring, intense, human and sinister character at the same time.And all of this fits into the reality that we are in the presence of a drug-related musical that, despite the filth of its form, because we must be clear, is not an old-school musical, it is a dirty musical, with daring and unexpected songs and lyrics, but which add a formidable height to a rather groundbreaking visual and sound experience that fascinates in its final result.So what is Emilia Pérez herself?It is a film that goes beyond a film, it is a creative challenge on the part of its director that at times turns out well, at others it turns out a bit more confusing, but it leaves the feeling that we are faced with a hypnotic proposal, impossible to abstract from and that although it has its imperfections, the daring of a director to offer something that breaks the mold seems quite satisfactory to me.It may have wrong and simplistic decisions, but it also has an intention to make you uncomfortable and make you reflect on different aspects that go beyond a visual proposal, it is also a film with intentions to generate mental debate and that for me is the great success of Emilia Pérez.In short, we have one of the most interesting films of the year, which may be strange, but it is daring, it is not perfect, but it is interesting, it is a bet on pure cinema with a director who goes beyond conforming, it is a director who dares to try new things and that is a courage that must be recognized as a great virtue.It deserves to be seen and to have your own feeling about Emilia Perez.",7,4,50,0.13418935902806872,0.48612658846529805
,"Una película fichera hecha por extranjeros,","The story of a drug lord who changes gender and is worshipped despite being a criminal and being viewed favorably by the families of the people he disappeared with, who pretend to speak Spanish and pretend to be Mexican and no more focus or attention is given to the Mexican person in the film, its what they call a file-driven movie.The only thing worth mentioning is his color palette, the only person who knows what he was doing, The madres buscadoras de desaparecidos who are all over the country trying to find their unknown relatives would not think it would seem that Zima Entertainment is profiting by praising a film that glorifies drug trafficking.",1,47,4,-0.05000000000000001,0.4166666666666667
,"Well, that was... something","Emilia Perez is a bizarre movie to say the least, but that doesnt necessarily make it a bad one, not usually anyway. Out of all the plots to make into a musical, this is definitely one of the strangest, and it doesnt always work. The strongest part is arguably the section leading up to when the main character has the surgery, as thats where the plots most flowing. Afterwards, it becomes more episodic, and it sometimes feels like it doesnt know what to do with itself now that the big event has happened, so it just throws in a bunch of stuff, in at least one instance forgetting a plot point from before. With that said, the stuff it throws in is at least interesting and there are some neat ideas, like Emilia using her former mob ties to help find mob victims. The acting is solid, especially from Karla Sofia Gascon and Zoe Saldana. However, I quickly came to the realization that I dont really like Emilia as a character. Shes way too selfish and does some awful things, which makes her really hard to sympathize with.Can I just say that I hate it when a movie has a ridiculous amount of production logos at the start? This film has like seven of them, and I know they want to give the people who worked on it their dues, but as an audience, we just want to get to the movie. Anyway, even though the decision to turn this story into a musical was bonkers, its at least a really good one. The songs are really catchy, well sung and well directed. Theres a decent mixture of fantasy style numbers and real world style ones. And I appreciate seeing a musical where the songs actually develop the characters and give us insight into their headspaces; thats actually really rare nowadays. Outside of the numbers, the film is also well directed, though there are some questionable choices, like a scene where a whole conversation is done in ADR over a really long outside shot of Emilias house.Overall, I liked Emilia Perez to an extent, but some of the choices made really had me scratching my head. I can see why the rating on this site isnt great, because honestly, I dont know what to make of it sometimes. It didnt deserve the Golden Globe for Best Picture Comedy or Musical, I can say that much . Dont know if Id watch it again, but there were enough good scenes to warrant at least one viewing.",7,4,51,0.06433333333333334,0.4521666666666666
,Don't waste your time.,"I dont even know how this movie got made.Its terrible. Like unwatchable terrible.Its not just that the storyline was flat, or the odd depiction of the Mexican drug world, its the bad acting, the unbelievable characters the lack of authenticity that killed it for me.It seemed like they hired 2 really good actors expected their star power would get people in the seats, rather than the quality of the movie. Doesnt matter how good an actor is, if they bare given a bad script, its still a bad script.The movie was WAYYYY too long. Not only did I lose interest 15 mins into the movie, I was watching the clock looking for an exit for the rest of it.I cant compare it to an Opera, because Operas are beautiful the music always touches your soul. These songs were grating and irritating to the soul.But I CAN compare it to JLos This is me....now: A Love Story. If youve ever seen that piece of crap, youll understand what I mean. So many WTF moments in both films.Dont waste 2 hrs watching this film. Its not worth it.",1,39,3,-0.11816666666666664,0.5185000000000001
,Pretty creative,"The movie caught me off guard, in the best way possible. From my perspective - a viewer who doesnt speak Spanish and isnt deeply familiar with life in Mexico - it felt fresh, creative, and unexpectedly gripping. The decision to cast two high-profile American celebrities was a smart one, a hook for those who might ordinarily skip a film like this.Zoe Saldana was a revelation. Her Spanish wasnt just fluent; it was lived-in, natural, like shed been waiting for this role all along. Selena Gomez surprised me too - sure, shes faced criticism about her Spanish, but to my untrained ear, it sounded decent. More than that, she delivered. She gave effort, and effort counts.But the real standout? Karla Sofia Gascón. By the time those raw, emotional musical moments toward the end hit, it was her performance that stayed with me. She didnt just act - she became something bigger than the story itself. And thats what makes this movie more than just a clever idea. Its captivating, from start to finish.",7,4,51,0.2056739926739927,0.5217313797313798
,It's very insulting and unacceptable,"As a Mexican, it is very offensive for a foreigner to say that he knows enough about a country that he has clearly never visited and to tell a story about a common topic in such a vain and silly way. He has a biased view of what this issue means for our country and anyone who wanted to take advantage of that is simply unacceptable. The songs are an insult to other movies that are musicals indeed. The fact that Sofia called the Mexican public ignorant just because she felt important in the film makes it lose even more of its value. Selena Gómez its just another bad example of everything thats wrong with this movie.",1,39,3,-0.07166666666666664,0.46158730158730166
,Surreal and original,"Emilia Pérez couldve sustained itself on the sheer audacity of its genre bending madness but what makes this musical crime drama about the trans experience really work is the genuine heart at its core. The trans narrative and the musical numbers go hand in hand with an overall unpredictability that gives the film many of its biggest surprises. The crime drama aspects are played surprisingly straight and the middle successfully turns into Mrs. Doubtfire.Zoë Saldaña is fantastic in a performance where she eschews subtlety in favour of something bolder with each musical number showing a previously unseen set of skills. She guides you through the opening moments and then Karla Sofía Gascón begins to take control without Saldaña feeling sidelined. Gascón is amazing because her performance has so much earnesty as she embraces her new life whilst holding onto the best parts of her old one whilst struggling to accept some of the revelations from her former partner.Like some of his previous efforts, Jacques Audiards direction unfolds at a steady pace, taking its time to follow the lives of his characters wherever they go. The musical numbers are excellent with a real variety. Theres a surreal element to them due to their lyrics alone and each one works whether its characters essentially just singing their dialogue or its the bigger choreographed numbers in which Paul Guilhaumes snappy cinematography stands out.",8,20,144,0.20159632034632033,0.37724567099567113
,Interesting plot,"Drug Lords, transgender and a musical? Yes, at first it sounds weird but is interesting.Im not such a big fan of musicals, but the musical scenes were really good.The first 2/3 of the movie is interesting and you are wondering whats going to happen next. The final third goes down and is poorly developed, Id expected more of the same.The acting in general is ok, with Zoe Saldaña doing a good job even tho she doesnt sound Mexican. Actually no character sounds Mexican and thats a low point.Most characters you can understand despite their wrong accent ... the problem gets with Selena Gomez. I know they tried to mask her horrible spanish but it wasnt enough. I like her, but there are lot of other actresses who speak spanish perfectly ... even in Mexico duh.The Selena Gomez accent is no a minor point, from moments you feel like watching Will Ferrel in Casa de mi Padre, and even that was more descent.",7,4,55,0.07630718954248365,0.3626633986928104
,French white man colonizes for entertainment,"Deeply problematic. It seems that Jacques Audiard, after a vacation in Mexico, decided to include everything that caught his attention about our culture in a cinematic project, but without the rigor or sensitivity required to address it properly. Its highly questionable for a white European man to, first of all, create a film about a country that doesnt belong to him, and second, attempt to depict issues like problems for women of color in Mexico, drug trafficking, kidnappings, and gender identity.While its true that filmmakers can explore other cultures, doing so comes with a great responsibility, one that Audiard seems to overlook. If youre going to tackle these topics, the least you could do is give space to authentic Mexican voices, both on and off-screen. Why is Selena Gomez, with poorly learned Spanish, prominently featured in the promotion of the film if shes not even the main character? Why cast a Dominican actress in a role meant to represent a Mexican woman, even forcing her to claim in the film that she is Mexican, when neither her accent nor her appearance aligns with the cultural identity shes supposed to portray? Do you really think all Latinos are the same?The movie tries to do too much and does too less: complex issues are treated superficially, mystified, and misinterpreted. Its painful to see our culture exploited, reduced to a caricature of our struggles, and ultimately colonized for entertainment, especially when these portrayals are celebrated and awarded by people who fail to understand the profound implications of what theyre consuming.That the film industry chooses to place such works on a pedestal only makes me realize the sad reflection of this society. Viva a la industria del cine...",1,32,2,-0.0026190476190476176,0.4488095238095238
,Vibrant and audacious.,"Emilia Perez is a vibrant and audacious exploration of identity, transformation, and the fluidity of gender. This musical drama, infused with the intoxicating rhythms of Mexican narcocorridos, tells the story of a drug lord who undergoes a life-altering sex change operation to disappear from the cartel world and re-emerge as the woman she always felt herself to be.Gascón delivers a captivating performance as Emilia, portraying her journey with a delicate balance of vulnerability and strength. Her portrayal is both fierce and tender, capturing the complexities of a character grappling with the ghosts of her past while embracing a newfound freedom.Audiard masterfully blends genres, seamlessly weaving together elements of musical, thriller, and melodrama, creating a truly unique and unforgettable cinematic experience. The films visual style is equally striking, with bold colors and dynamic camerawork that perfectly complement the narratives energy and emotion.Emilia Perez is a powerful and poignant film that celebrates the courage to embrace ones true self, regardless of societal expectations or the consequences. Its a testament to the transformative power of love and acceptance, and a reminder that identity is a journey, not a destination.",8,14,99,0.23068181818181818,0.5257575757575758
,"Is not that bad, but there are issues.","Ok, I want to start by emphasizing that I am Latina-not Mexican, but Latina. I dont think its a bad movie; I really liked Zoe Saldañas performance and Karla Gascóns as well. We can discuss whether this woman is racist or not, but she does act well.I understand the hate, Ive seen the memes, and its clear that theres an issue with a French production tackling a Mexican story while featuring so few Mexican actors. However, its not like what the movie portrays isnt true-disappearances, corruption, and social decay all happen.Now, whats the real problem with this film? Selena Gomez. Im sorry because I think shes a good actress, but in this case, the casting was a failure. Her poor Spanish and how forced she looks in every scene ruin it whenever she appears. If you analyze it, almost all the memes come from her scenes.Another issue is that they made it a musical. The songs are bad, and most of the cast sings terribly. They could have just made it a movie about a controversial topic without turning it into a musical.To wrap up, its not a bad movie, but its not a masterpiece worthy of 13 Oscars either. Social media keeps making things go viral, leading people to take extreme positions. My recommendation? Watch it with an open mind, leave biases aside, and form your own opinion.",6,1,6,-0.018678160919540228,0.47471264367816085
,Nonsense,"I just dont buy the premise to this story. Is this supposed to be a fantasy? A ruthless Mexican cartel boss identifies as a woman and undergoes transition... Such a thing has not and will never exist in the real world. I can suspend disbelief for certain plot lines but this is not one of them. If it is supposed to be a fantasy, they nailed it, because I would be more inclined to believe dragons and elves exist than a homicidal drug lord deciding hes actually a mild-mannered woman on the inside. Stupid movie, whoever wrote this script should help George R. R. Martin finish those GoT novels hes been promising us. Spare yourself the secondhand embarrassment and skip this one.",1,69,8,-0.07857142857142857,0.47714285714285715
,Emilia Perez is not for musical fans,"Emilia Perez is a film that has sparked considerable discussion due to its length and content. Many viewers feel that the movie is excessively long, with numerous filler scenes that do not contribute meaningfully to the narrative. A significant point of contention is the inclusion of extended musical numbers. Critics argue that these segments are not only poorly executed but also largely unnecessary, detracting from the overall experience, especially for fans of musicals who may have higher expectations for such performances.The plot of Emilia Perez has been described as convoluted, often requiring the audience to infer critical details without sufficient context. This ambiguity is particularly evident in the films climax, where it remains unclear whether the gangsters hired by Zoe Saldanas character or their adversaries emerge victorious. Such unresolved plot points can leave viewers feeling unsatisfied and questioning the narratives coherence.Beyond these specific critiques, the film has been the subject of broader discussions in the media. For instance, an article in The Cut examines the portrayal of transgender women in Emilia Perez, suggesting that the film offers a dated perspective that may not resonate with contemporary audiences.Additionally, a review in the Miami New Times goes so far as to label the film a disaster, criticizing it as not only the worst film of the year but also as a vicious insult to both transgender individuals and the nation of Mexico.These critiques highlight the films controversial reception and the varied responses it has elicited from audiences and critics alike.In summary, Emilia Perez has been met with mixed reactions, with particular criticism directed at its length, unnecessary filler material, and ambiguous plot developments. The extended musical interludes have been singled out as poorly performed and superfluous, potentially alienating musical enthusiasts. The films demand for audience inference, especially regarding critical plot outcomes, further contributes to its contentious reception.",7,3,40,-0.027551834130781497,0.5358652312599681
,Worst movie I've seen in the past 3 years,"Where do I start ? First of all, the lyrics of the musical part sound like they were made by chat gpt. It has no flow, no rhyme scheme, no nothing. The spanish is so bad I questioned by own understanding of the language. Can we stop considering american born people who cant even speak Spanish and never even been to latin america as latinos?The french director clearly never been to mexico or interacted with Mexican culture in anyway other than in his own head. The plot was straight up bad. Having the last name Perez, this movie made me want to go to court for defamation, not because of the drugs and stereotypes but because this the worst movie to ever exist. How did this even win an award at all?",1,45,4,0.015277777777777791,0.3717592592592593
,Not what is expected,"Film can be argued as a mainly spanish film. The amount of of English or french in the film is not significant in quantity for it to be noted as a mix.The treatment of serious tones with musical grapples with the viewer, film sometimes breaks the fourth wall to addresses the audience The amount of themes that the film tries to grapple is overtly ambitious to the point that it gets a bit lost .It is defo an unusual and arresting take that has some talk points, but overall, I did not enjoy the film on the premise that it was hard to follow the topic and the 3 mains. Very hard transitions between scenes too as well that sometimes is disorienting. Topic wise, i can empathise with its importance and significance.",7,3,40,-0.022777777777777772,0.42250000000000004
,The worst musical (and possibly movie) in history,"Not only a lack of respect for the Mexican people and Mexican culture, but an absolute lack of respect for cinema as a whole, for the musical genre and for the public. The festivals and the critics have been bought, its obvious.When you make a musical and all your singers sing badly and the music is cheap, when you take a subject as serious as the disappearances of human beings by Mexican cartels and gender conversion and you make a funny choreography where they sing about sex change procedures and prices, when you decide to make songs in Spanish with people who dont speak Spanish and you dont even check if the phrases make sense, you are not taking your job or the cinema seriously at all. If you do that with a subject that is not yours and that is a sensitive subject for the culture you are trying to represent, you are simply disrespecting everyone.Why do you do that if you are such a good and intelligent director? For money, A LOT OF MONEY.",2,16,0,0.031333333333333345,0.41695238095238096
,Thought provoking,"Emilia Pérez is a groundbreaking cinematic experience that defies traditional storytelling, blending genres with audacious creativity. This musical drama explores complex themes of identity, redemption, and transformation through a unique lens of magical realism. Director Jacques Audiard crafts an extraordinary narrative about a transgender cartel leader seeking personal reinvention, told through sixteen riveting musical numbers that pulse with energy and innovation. The film masterfully navigates between crime thriller, musical, and social commentary, creating a genre-bending experience that is simultaneously heartfelt and provocative. Zoe Saldaña delivers a phenomenal performance as Rita, the lawyer who becomes integral to Emilias journey. The films bold visual style and unexpected musical interludes transform what could be a conventional story into something truly remarkable. Its What sets Emilia Pérez apart is its fearless approach to storytelling. It tackles serious subjects like Mexicos drug wars and gender transition with sensitivity, humor, and extraordinary artistic vision. This is not just a film, but a cinematic revelation that challenges audience expectations and pushes artistic boundaries.",8,10,65,0.1788003663003663,0.5714285714285713
,"Unusual musical, in a good way","Zoe blew me away, and I loved Karla, both deserve recognition. While its an Emilia story, it was Zoe that carried this film, somehow she is the film and her Zoes performance carried it. Its about time that two lead actresses get recognized in leading roles, if we want to talk about equality, we should move away from only recognizing that the lead should always be from opposite genders, any movie that has a female lead gets my attention, with this film, which has two female leads, I was hooked.I just hoped that some of the songs had the wow factor, at least one of them should have, but unfortunately none of them did. Its definitely a new take on musicals and thats good, appreciate this approach and would love to see more experimenting in this direction.Bingo!",6,3,40,0.16344696969696967,0.5573232323232323
