Movie,Title,Content,Rate,Upvotes,Downvotes,Polarity,Subjectivity
,The Worst representation of Mexico's actual drug problems,"I am Mexican, and I can tell you that this movie is an awful representation of the narcotics problem in Mexico. While the story initially seemed interesting, it quickly became ridiculous. The main premise of the film is that a cruel assassin drug lord becomes a martyr after losing his penis. Additionally, Selenas acting is subpar; she cant even speak Spanish well, despite being cast as a Mexican character. None of the main actors are Mexican, and their Spanish accents come from Spain and the Caribbean, and frankly incomprehensible in Selenas case.Overall, a good idea turned into a bad movie.",5,1122,116,-0.07291666666666666,0.3708333333333334
,A Tone-Deaf Musical Disaster,"Emilia Pérez has sparked significant controversy, and for good reason. From the outset, the lack of Mexican representation like a glaring oversight. The French directors admission that he didnt feel the need to research Mexico, paired with the casting directors claim that no talented Mexican actors could be found, only adds insult to injury. These choices reflect a tone-deaf and dismissive approach to authenticity.Whats even more baffling is how Emilia Pérez managed to garner so many Oscar nominations. While the Academy has a history of nominating films with problematic undertones , those at least offered stories that entertained broad audiences. Emilia Pérez, however, doesnt even accomplish that. The story is dull and lifeless, so much so that out of three of us who watched it, two fell asleep, and the third decided to switch to another movie.To make matters worse, Emilia Pérez is a musical - but not in a good way. The songs are forgettable at best and cringe-worthy at worst, and most of the cast can barely sing. The musical numbers, which should have been a highlight, drag the movie down even further.That said, there are a couple of redeeming elements. Zoe Saldaña and Karla Sofía Gascón deliver strong performances and truly dont deserve the backlash tied to the films broader issues. Their nominations are the only ones that feel genuinely earned. Unfortunately, the rest of the film is a mess.Overall, Emilia Pérez is an underwhelming, uninspired production that fails to justify the attention its received.",4,20,2,0.04136284722222221,0.46189236111111115
,"okay, so","The problem with this movie is not Selenas Spanish, I dont find this movie particularly bad but some of the dialogue is really cringy and as a Mexican none of the people from here use the terms that were in the movie. The portrayal of Mexico in this film is very stereotypical and sometimes that isnt bad, but I think they should had cast real Latin writers and supervisors to make this movie more accurate and respectful to the country. The fact that the director doesnt speak Spanish or even English speaks volumes of the commitment to understanding what the movie is about and the emotions that triggers.Also the songs are horrible.The only thing salvageable is Zoe Saldañas performance.",6,383,104,-0.019230769230769197,0.43589743589743585
,Not Worth Your Time,"I will start out by saying I am not a fan of operas. However this film was not what I had expected. The main characters were mostly unlikable. The plot was rather ridiculous. Certain actors were very miscast. Selena Gomez needed Spanish lessons. I am sure that anyone who lives in Mexico will hate this movie. The director isnt Mexican. I saw all the awards at the Golden Globes and that is the ony reason I decided to watch it. If you like any of the actors, you may want to give it a try. However I would have to say watch at your own risk. It is one of the worst films I have seen in the recent past.",,636,69,-0.00015873015873015816,0.5262433862433862
,"Emilia Perez: Ambitious Themes, Incomplete Execution","Emilia Perez isnt a bad movie, but it felt somewhat flat. At times, the story seemed too easy for the characters, lacking tension or conflict. Emilia, in particular, transforms into an overwhelmingly positive character, even though we know from the backstory that she wasnt always so good.The movie tackles a wide range of themes but struggles to fully explore them. Instead of diving deeply into any one idea, it spreads itself too thin, leaving several threads underdeveloped.As someone who doesnt typically enjoy musicals, this film didnt change my mind. However, I can appreciate that this was the directors vision, and I know many viewers will enjoy the musical elements. To its credit, some of the musical numbers were well done, especially those performed by Zoe Saldana. Her performance was a standout and arguably the films biggest revelation, elevating many scenes with her presence and talent.Overall, Emilia Perez is an enjoyable film. While I dont quite understand its acclaim at Cannes, it has its moments.",6,186,128,0.11189839572192514,0.45610516934046347
,No way this got 13 oscar nominations.,"Sorry, Ive got to say it. EMILIA PEREZ IS NOT A GOOD MOVIE. Its not a Razzie film by any stretch, but its practically incoherent narrative flow, at times excruciating dialog and lack of internal logic leave it as a mediocre straight-to Netflix commoner in the movie space. Ill give you an example of its bad script, in the movie the characther says Bienvenido which means Welcome, but in the context of the conversation she means to say Your Welcome, De nada in Spanish. It seems they did the writing in French and use google for translation. Yes, it covers some important themes and issues, but that doesnt make your movie good. You still have to build a fundamentally good film around the issues or its just noise. And thats Emilia Perez... just noise.",3,721,42,0.046428571428571465,0.6023809523809524
,Overhyped!,"Emilia Pérez is, at best, just okay. It feels incredibly overhyped, and I honestly dont understand how its winning so many awards. Zoe Saldana delivers a strong performance, but the rest of the cast is just average.The film tries to mix crime, drama, and musical elements, but the execution is uneven. Some scenes drag, making the pacing feel sluggish, and the emotional moments often seem forced rather than genuine. While the cinematography and production design are impressive, the storytelling lacks depth. Its a film that aims high but doesnt fully deliver. A 6/10 for me-decent but forgettable.",6,59,38,0.28196078431372557,0.5084803921568628
,Hard to watch,"Emilia Pérez is a musical that has sparked debate due to its themes and execution, particularly in Mexico, where its release has been surrounded by controversy. I watched it with an open mind, aware of its narrative, focus, and genre. However, I came away with mixed feelings, which I will break down into three key points: stereotypes, performances, and the script along with the songs.1. Stereotypes: Its impossible to discuss this movie without addressing its cultural treatment. From the very beginning, it feels more like a collection of clichés about Mexico than a genuine exploration of its culture. As a Mexican, Im not offended by stereotypes per se, but here, there seems to be no interest in delving deeper. It feels like a brainstorm of references-sombreros, skulls, and tequila-without adding anything meaningful to the narrative. This lack of authenticity turns the setting into a caricature. The production could have set the story in any other country, swapped these clichés for others, and it wouldnt have made much difference to the plot.2. Performances: Its interesting that the performances have been nominated for multiple awards. However, as a Spanish speaker, the accent and diction were constant distractions. The actresses seem to be trying hard, but the result fails to convey genuine emotions or connect with the audience. A crucial part of acting is mastering dialogue delivery, intonation, and how these elements evoke empathy or rejection toward the characters. This doesnt happen here. No character made me feel their story-I didnt suffer with them or celebrate their victories.3. Script and songs: The script, unfortunately, is one of the films weakest points. The dialogues feel as though they were mechanically translated into Spanish, riddled with errors in conjugation and awkward phrases. This extends to the songs, which fail to work as either music or narrative tools. In a good musical, the songs should integrate organically and move the story forward, but here, they feel forced, as if they were shoehorned into a pre-existing structure without concern for rhythm or coherence.4. The theme: The film touches on a sensitive nerve for Mexicans. Its complicated to humanize drug cartels in a country that suffers the direct consequences of violence, disappearances, and daily fear. The idea of portraying a drug lord as someone deserving of redemption, who wishes to transition to stay true to their identity and even becomes a benefactor of social causes, can feel insulting. For a foreign audience, it might be an interesting narrative, but for those living in the reality of drug-related violence, this idealization borders on indifference toward collective suffering.In conclusion, Emilia Pérez has some interesting technical elements and isolated moments worth noting, but as a whole, its not an enjoyable film. The lack of authenticity in its cultural representation, performances that fail to connect, and a weak script weigh it down too much. That said, cinema is subjective, and if this movie finds its audience, good for it. But for me, rather than being a captivating musical, it was a frustrating experience.",1,1017,65,0.020354406130268204,0.42418582375478925
,"Fine, but there are two big problems with this","This is an ambitious film that certainly succeeds in combining several genres. It is also a film that manages to fascinate and captivate for its whole, long running time.However, there are two major problems: First: the film is ridiculously moralistic.Second: it is absurd to believe that nobody would immediately question the identity and therefore the background of the main character. Her motivation is legit, she wants to make amends, but it is mindboggling that the filmmakers apparently thought it could go unquestioned when the protagonist, a mysterious woman in every respect, carelessly decides to enter the spotlight.",6,150,120,0.035416666666666666,0.5119047619047619
,WINNING AWARDS DON'T MAKE A FILM GREAT!,"Stupid film with stupid sentiment. Lot of the musicals doesnt fit and make sense at all. Felt forced kinda like Joker 2. Why was Rita selected, how she managed to do so many illegal stuff like an expert just with money, nohing explained! Can a lawyer do all of these? Anyways, I couldnt find any fault jn Gustavo. He didnt even know that Emilia was Manitas before his death! And after all that Emilia did, are we supposed to feel sorry for her? She was a cartel leader, did lots of bad stuff and at the end also did bad stuff forcing his children to stay with him without explaining anything to his wife! I feel bad for the kids. Their father ruined the whole family by running after his personal gains only. He never thought of anyone else but himself.And why is Rita always with them? I mean does she have no family or close ones? Rita and Emilia did lots of illegal stuff to get rich and the film tried to justify it by sentiment and emotion. And people are praising them for the NGO whereas they themselves are twisted. The song where Rita mocks the corrupt people also doesnt make sense as she herself did illegal stuffs to get rich!Some of the visuals are good and thats why Ive rated it higher, otherwise this is garbage.",2,145,5,-0.2544642857142857,0.6589285714285714
,Too many cooks in the kitchen,"Just finished watching Emilia Perez and it was fine I guess. There is a lot to like and dislike in this movie.Positives for Emilia Perez : The movie looks good with some great cinematography. The movie does get ambitious with the blending of genre thrown into the mix and I appreciate that. The performances from Zoe Saldana and Karla Sofia Gascon are very good. The musical numbers are fun to watch. And finally, I thought that the movie did a great job at telling its transgender story.Mixed for Emilia Perez : While the movie is certainly ambitious with its blending of genres, there are elements to this that felt out of place in this movie. The musical numbers feel like they just came out of nowhere and it felt jarring at times.Negatives for Emilia Perez : The movie is way too long and I feel that this movie couldve told its story with a shorter runtime. The movie lost my interest almost immediately and it just became background noise for me.Overall, I admired the filmmakers and actors for being ambitious with this movie, it just fully worked for me. However, I would still recommend this movie to people, if they are interested with this movie.",6,76,123,0.34833333333333333,0.5521428571428572
,Is this a joke?,"As a Spanish native speaker i found this movie disrespectful and childish. The spanish speakers characters can barely pronounce two words, turning the whole script into an uncomfortable caricature. Although disguised as a modern production, they fall into the same errors of typecast Latinos into same old stereotypes. The only valuable thing is the attempt to offer something different by mixing a Spanish language film with a musical, however its execution becomes irritating to watch. Im sure any positive reviews must come from someone totally unfamiliar with the Spanish language, as this is a determining factor in making this film totally inedible and a endless meme material.",1,851,59,0.0024891774891774867,0.43496873496873495
,Save your time and money.,"The hard truth about this movie is that people who have visited Mexico keep coming only to Cabo and Cancun where drugs, alcohol and sex are still a thing; instead of educating themselves and visiting Mexico City, Guadalajara, Monterrey, or Puebla. The United States of America citizens are the main consumers of narcotics in the world. Natural born consumers of anything they see such the latest IPhone. As long as these ignorant people exist, Mexico will be unsafe for us the citizens.And yet somebody thought it was a good idea to make a movie about this. And to make things worse, filled with stereotypes.There is no place for this kind of content.",,93,15,0.15681818181818183,0.6431818181818183
,The movie has a lack of focus,"I think the film juggles too many themes, and none of them are fully explored, leaving the narrative feeling rushed and incomplete. And as a result, it feels like a collection of ideas rather than a cohesive story.I also didnt quite understand why it was framed as a musical-this choice felt disconnected from the rest of the story.The performances are solid, but the characters arent developed enough to create a lasting emotional connection.However, I really liked the cinematography, beautifully shot and visually captivating.To sum up, the movie leaves you wanting more depth and clarity.",6,39,74,0.255,0.43499999999999994
,I can't believe this has 13 Oscar nominees,"This movie is considered one of the best motion pictures of the past year? How? What a miserable experience. Why is this movie a musical? WHY? None of the songs do anything to advance the plot or tell us more about the characters, in fact the awful songwriting makes every scene with a song feel like instead of getting a deeper understanding of anything through song, the song is being used to tell us things that we can already see on screen and would be way more effectively communicated through better visual storytelling. The songs also dont really have any structure to them, they dont go anywhere. It genuinely feels like it was translated by Duolingo and the awful delivery of the lines doesnt help matters at all. Karla Gascón is fine...but not that fine to be nominated for an Oscar.",1,600,45,0.06190476190476192,0.5035714285714286
,Strangely bleak,"Enjoyable enough movie with two demanding leading roles and two supporting roles requiring excellent performers. The first two are played by Zoe Saldaña and Karla Sofia Gascón, the second two by Selena Gomez and Adriana Paz. This quartet shared the Best Actress award at Cannes 2024. They deserved it. Saldaña in particular is a revelation.Of writer-director Jacques Audiards previous films, Ive seen four , each memorable in their different ways. None of them prepared me for this one, so hats of to him for not getting stuck in a genre rut.Theres a lot of story and a lot of singing in Emilia Pérez. When the singing is paired with Damien Jalets incisive choreography, the effect is thrilling. Otherwise, the songs drag the movie down. They are musical-theatre lite, dont dig deep, so are not up to the dramatic demands put upon them. Theyre at their best in the rap-inclined numbers, where rhythm is the most important element.The moral of Emilia Pérez seems to be that we can never slough off the past, change who we are or what we want. Its a strangely bleak vision to present in a musical.",6,66,141,0.15462962962962967,0.4476273148148148
,It's a caricature,"I am speechless... Im guessing all the positive reviews are from people who a) dont speak Spanish and b) wanted their caricatures of Mexicans and trans people confirmed.The dialogues are insufferable, no one speaks like that, the music is jarring, the accents are not good.The bad words sprinkled thought the movie feel so unnatural, not only because of the delivery, but how they are used. This was clearly written by somebody with some vague knowledge of Mexican culture, but definitely not enough to make something good.The only redeeming quality this movie has is that its undoubtedly pretty. Thats it.Mexican people should avoid it at all costs.",2,1093,98,-0.011157024793388415,0.5541322314049587
,Felt like a fever dream,"A musical about a cartel leader undergoing a transition into a female social activist was not on my Oscars bingo card. I am a bit confused on how it snagged a leading 13 Oscar nominations. I really wanted to like it but it felt all over the place, the story felt off somehow... not satisfying i suppose. The movie being a musical seemed really random and the songs were not that great. I dont want to be super negative because it did have some good moments with the acting, costumes/makeup, and some of the choreography. Zoe Saldana and Karla Sofia Gascón put on a great performance and I think that they are deserving of some recognition but I still cant get over the 13 nominations.",6,16,37,0.13444444444444445,0.44000000000000006
,Everything but mexican,"Only money is capable of making someone consider this film a good representation of history, culture or anything, on its own or considering the Mexican context. The number of nominations and awards only demonstrates this, that the outpouring of money moves the vote. The Mexican majority itself finds the film disrespectful. A French director who thinks he knows enough about Mexican culture, an international cast with a Mexican actress who isnt even being considered in the awards campaign. Its simply bizarre and frightening that the film industry and academia genuinely consider this work.",1,552,49,0.11999999999999998,0.44
,one word : flabbergasted,"Came to write this after seeing its gala screening at the London film festival.A wild, insane roller coaster of a film that mixes crime, comedy, musical and thriller all into one and succeeds with flying colours!The four actresses at the core are the strength and they were directed to perfection by Audiard.Karla plays her character pre transition and post as it comes to her naturally, having underdone it publicly as an actor. Its a powerhouse performance that is so of our time. Im proud to be alive in a time when a trans actress plays a trans role. And not only that, she nails it. The tragedy of leaving a life but the promise of the one shes always needed.Zoe gets to sing, dance, cry and laugh and everything which I think an actor dreams of doing, let alone in one film. I had never seen a film of hers before and I am so happy this was my first because she shines! Theres a scene of her in a car, where realising what has just transpired, she breaks down in hysteria. Think Margo in I, Tonya or Glenn in Dangerous Liasons. That scene alone should win her an Academy award. And she has a beautiful voice!Selena, for whom I was most excited to see this film, kicks it out of the ballpark. Playing a mob wife, that icy, storm-simmering-below-the-surface kind of woman which she needs to revisit IMO because as a young girl who endured intense scrutiny and then went through a psychosis, she knows it too well whats it like to keep a lid on too long. The one time during the screening where I felt I was having an out of body experience is where her character Jessi finally unleashes her emotions onto us the audience after years of being oppressed. The agony and anger is heard in her voice. Its evidence of why she has said acting is her true calling and how passionate she is about it. It would be stupid to still think shes a disney kid and still has something to prove. Her acting journey is truly so exciting as a fan of almost 2 decades.Lastly, Adrianas character is like the sunshine in the otherwise dark and twisted world the film lives in. She is poignant! And it perfectly complements the other 3 actresses work. She brings love and softness to the story through her work.One major thing to note is that this film is like an opera. It reminds one of the Umbrellas of Cherbourg, which was also almost entirely sung. Emotionally its definitely intense like one, with small moments of calm when you realise youre watching a film.The cinematography was brilliant. At the end of the film, selenas character lays almost unconscious on the passenger seat as her lover drives in rage. The way the camera pans across the car to her face... it felt like a painting, very poetic but tragic.So glad to have watched it before its netflix release. Its amazing when a film can make you feel like this. To take you out of your normal and drive you a bit crazy.",9,153,840,0.14095804988662133,0.6155895691609976
,Jacques Audiard tried to do too much,"Its a musical trans crime drama set in modern times in Mexico, Bangkok, Tel Aviv, Switzerland, and London, England. The two main characters are a Mexican lawyer, Rita Mora Castro , and a vicious cartel drug lord, Juan Manitas . Manitas has a wife, Jessi , and two children. After the film demonstrates Ritas legal capabilities, Manitas hires her to perform a service--find a surgeon willing to perform gender-affirming surgery secretly. Rita is also to resettle his family in Switzerland while Manitas fakes his death and becomes Emelia Pérez.Four years later, Emelia wants her children to live with her as their aunt in Mexico. Rita is again enlisted to assist with things. The film follows this initially successful transition that begins to sour as Jessi pursues a relationship with Gustavo and Emelia explores a relationship with Epifanía . It ends badly.With that plot, its hard to see musical numbers sustaining it. They mostly dont, except for one riveting dance number at a fundraising dinner by Zoe Saldana. The cinematography is occasionally stunning, but the plot jumps from scene to scene with many unresolved issues, e.g., why did the shootout end, and how did Emelia continue to function safely with drug lords after her transition? Jacques Audiard tried to do too much, and it didnt succeed.Zoe Saldana and Karla Sofia Gascón do very well; the direction is the issue.",6,26,83,0.13460743801652894,0.43068181818181817
,UNWATCHABLE,"As a Mexican and a musician, Emilia Perez was an absolute assault on my ears. The songs were atrociously written and horribly performed-an unbearable disaster from start to finish. The Spanish dialogue? Completely unintelligible, thanks to ridiculous accents and what seemed like Google Translate-level writing. Seriously, who thought this was acceptable?The story might have had some potential, but even that was destroyed by how horribly written it was. Any shred of creativity was drowned in a sea of incompetence. This isnt just a bad movie; its an insult to anyone who appreciates decent filmmaking. A complete and utter failure.",1,231,20,-0.21862745098039213,0.6058823529411765
