Movie,Title,Content,Rate,Upvotes,Downvotes,Polarity,Subjectivity
,What is the point of this movie?,"Okay, lets accept the ridiculous premise. Is the point acceptance or is it exploitive of the novelty its putting forward? The acting is not good simply because of ones immutable characteristics and yet this is the only central piece of the story. And on top of it all, its a musical. A not very good musical with no memorable songs or melodies. The actors say exactly what theyre feeling in their songs and there is little to no subtlety.I get it, its a giant metaphor for the trans experience and the longing to change for sake of harmony. What it ignores is the body is only the reflection of the mind. And if the mind is broken, the body cannot make one whole.",2,25,3,-0.018892450142450133,0.5121489621489622
,Engaging and troubling,"This movie is unique. It tells the tale of changing from a man to a woman in a very original setting. The transformation is more than a gender change: it is a transformation of character. The man is a criminal who has engaged in horrible crimes. His belief is that he was forced into this role by circumstances, but that he has always wanted to be a woman, which would afford him freedom to be the real self buried inside him. The huge life alteration this change implies makes the transformation far more dramatic than otherwise.What adds to the contrast between the two lives is the presence of Zoë Saldaña who looms over the proceedings like an extraterrestrial, underlining what is going on and adding huge depth to how we feel about what we see.You will be transfixed by this movie and forced to wonder what lessons it teaches us.",8,4,27,0.04070512820512821,0.6634615384615384
,Oh well...,"You hate yourself?Sad. But this is the perfect movie if you do.Bad songs. Bad acting. The photography is horrendous. They even used AI to enhancing the the voices of the actors. This alone would be deplorable, but is not just that, it didnt worked. Everyone sings so bad, looks like a very bad sketch from the worse season from SNL.Everything looks like a terrible joke, disrespectful with Mexicans, with trans people and, above all, with the art of cinema in general. Its an ugly movie, visually, musically and in any other way you can imagine.Dont hate yourself?Great! Go watch anything else. Really. Anything.Dont waste your time with this absurdity.",1,25,3,-0.3461764705882353,0.5691176470588235
,I dig this,"I was genuinely surprised by how this worked. Its easy to doubt it, yet the director and actresses managed to pull it off seamlessly. My favorite musical number was El Mal, but I also really loved Mi Camino. I just wish they had included it fully within the movie itself instead of saving it for the credits. The surgery room number was bizarre yet hilarious. It felt very camp and fresh..Gomez did an incredible job portraying the anger and frustration of a single mom caught up as a pawn in a larger scheme.Saldana deserves her flowers. She brilliantly captured the desperation of an undervalued lawyer making rash decisions and then having to face the fallout of those choices.Gascon was literally the bridge that connects everything, perfectly embodying the idea that no matter how much a person might change, their past is unchangeable.Theres a lot happening very quickly. After my first watch, my honest reaction was Well, thats interesting. It wasnt until my second watch that I truly absorbed everything. Overall, I genuinely enjoyed the movie. Its camp, weird, and refreshingly original.",10,7,61,0.27962454212454213,0.5934981684981685
,"Just a bad movie, not worth the hype","I was excited about the 13 nominations and decided to watch the film.From a cinematic point of view, it is an average film. The photography is correct, the rhythm works most of the time and the script is shallow, but ok. The acting is below average and not even the main actress can save it. Now the worst for me are the songs and musical scenes... the songs are bad, not memorable and take you out of the films immersion. They are laughable to sum up.The whole plot of the film about a big drug trafficker who redeems himself and has a rebirth with a woman , in which he is forgiven of his sins, seemed cheap to me and something I expected to hear from a sensationalist neo-Pentecostal church.I didnt mind Selena Gomezs Spanish and I also think that a director can make a film in a language he doesnt speak in a country he doesnt know deeply. But you have to have common sense and respect. The complete disconnection of a white European man with Latin cultures, the trans community and the romanticization of a war on drugs seems unforgivable to me. I give it 3 stars for the aesthetic effort and originality.In the end, I think the Oscar nominations show how they still have a total lack of knowledge and empathy for marginalized groups. Even when they have good intentions. But as they say, the road to hell is paved with good intentions.",2,25,3,0.005864197530864201,0.44814814814814813
,Awful,"Its like a real bad parody, like... Trying to be funny but failing at it over and over. The music is not creative, like it was written using AI, the acting is just lazy. Worst part is director being all arrogant thinking there was actually no need to investigate mexican culture, in order to make a movie about mexican culture. I found it to be just offensive.I understand the need of Sofia to proclaim herself the best actress in the whole world, but then she cant be offended when she learns that shes not good at all. Not good at acting, at dancing or at singing. And the same goes to Selena and Zoey .If you have the opportunity to watch this movie, dont take it!",1,20,2,-0.11666666666666667,0.475
,It's not worth it,"It is rude to say that this is Mexico. Is just the misconception of a man mired in ignorance and lack of empathy and research, on a much more serious problem than he portrays.And the discontent is not with Selenas accent, or the completely weird accent of Zoe Saldañas Mexican accent when the only thing Mexican here were the expressions that were not at all stereotypical. Joke.Not to mention the songs, my God. Who wrote that? The kid? Like why did Emilia or Manitas smell like Guacamole, Coke with lemon and ice, cigarette, lamb??? I mean, you can smell like all that, Ill forgive you if Manitas went to the market every day for a walk, but a little bath so the kid doesnt say you smell like a street food stand during rush hour.This film could have been incredible if the director had done what a person who is going to talk about a country, a topic, a problem as serious as forced disappearances would do. But karma or whatever you want to call it is coming little by little. Learning from this abomination: do your research, do not belittle the talent of the country you are talking about and Use your power to speak out and change a reality, not make it your filler for some weird victim-perpetrator romance.",1,20,2,-0.16127450980392158,0.6306372549019608
,I Loved It!,"I was blown away, especially after reading all the negative and highly qualified reviews. I loved the format, the context, the choreography and the music. Acting was stupendous! Im not familiar with the directors work and not being Mexican, I cant speak to the vernacular, but I thought it was wonderfully creative. Enjoyed it throughout. Would never have expected the transitions that occurred and benefitted from the IMBD interviews with Karla Sophia Gascon about the challenges of filming in a non- linear/temporal manner. Dont miss the opportunity to view this film. Its quite terrific and is a real contender for the Oscar.",10,7,61,0.12270833333333332,0.5533333333333333
,one of the worst movies i've ever seen,"Emilia Pérez is an unmitigated disaster that fails on every conceivable level. The films attempt to blend a crime drama with a musical is not only misguided but painfully executed, resulting in a jarring tonal mess that leaves audiences cringing rather than entertained.The portrayal of Mexican culture is nothing short of offensive, relying on tired stereotypes that reduce a rich and diverse heritage to a series of clichés. The decision to cast non-Mexican actors in key roles, coupled with the atrocious Spanish accents, only adds insult to injury. Selena Gomezs performance is particularly egregious; her Americanized Spanish is distracting and inexcusable.",1,32,5,-0.11458333333333333,0.4848958333333333
,Bold and Very Risky,"IMO hands down, one of the best movies of the year. The movie tells such an original story about how drug cartels and corruption have just wrecked Mexican society and innocent lives. Gascon perfectly portrayed both the cartel leader and a woman trying to *fix* her past mistakes.Anddd, I love Zoe Saldana. Been a fan since From Scratch and Lioness, so when I heard she was starring alongside Selena Gomez, I was already hyped. They didnt disappoint at all.But real talk, the Spanish with English subtitles was kinda tricky for me. The movie moves so fast, and I was struggling to read the captions and actually watch the action. Its like, by the time I finished reading, boom, next line. Had to keep rewinding to catch everything. I guess Im just not used to it..Anyway i really liked the movie. The cast is top tier, and the story is unforgettable.",10,7,61,0.2826023391812866,0.40994152046783616
,Something doesn't make sense here,"When you make a movie, write a book, a poem, a song or play an instrument or sing its because you know what youre doing, you know what to talk about, you know the notes, or you have a tuned voice, when you talk about a country you have to have been there or have studied the place in detail, when someone sings its because they have a voice, when the song is good its because it makes sense or has a minimum rhythm, none of this is seen in the movie and even worse they have it as the movie of the year, Barbie was better and thats saying a lot.You want to do something that is truly worthwhile, study and look, know, learn, be humble to recognize.",1,15,1,0.21999999999999997,0.52
,A hymn to Eurocentrism,"I dont even know where to start.Im not in the position to point out all the issues with the trans representation, but as a mexican woman I can speak about other issues:The script is poorly written. From the songs to the dialogue it uses phrases and words that make it obvious the writers were not familiar enough with the language. Some grammar mistakes are toddler level and the accents make it feel like none of these characters have lived in Mexico for even a year, resulting in dialogue that feels too forced and fake.The characters are lacking soul and their journeys are just not believable. Id like to say that Saldañas character is at least a bit savable, but Rita is just so boring. Trying to represent a strong and intelligent woman who criticises the system, but does nothing to actually stand up for her supposed beliefs.The portrayal of Mexico feels like nothing but a racist and insensitive caricature. From the sets to the actual plot. You have people being attacked at a Tianguis while also having Rita working with her laptop there. You have the characters living in Mexico City but somehow the final scenes tale place in a desert-like area?Audiard takes a very serious, very painful problem, and doesnt bother to touch it with the respect it deserves. Having narcos and politics having a change of heart and helping the searching parties when in reality those are the people that shut them up is incredibly disrespectful to their fight. Having a searching mother kissing Emilias hand and then turning her into a saint is a grotesque show of ignorance and unwillingness to learn about this issue in depth.Cruel art should not be celebrated. Specially when its author is profiting from our issues and pain while rejecting mexican talent and refusing to educate himself. Its so sad that this is the voice that critics are willing to hear.",1,15,1,-0.07772321428571431,0.5936011904761905
,Dont waste your money,"I want to stop the movie since the intro its a bad representation of Mexican culture but as a movie its a terrible musical, the music, lyrics, timing OMG. The performances are disappointing i cant understand why received a lot of nominations against another movies. The problem its everything not only Selena Gomez she could be better but she is not interesting in Mexican culture, language as the same way the director. This is offensive for really good Mexican actors worst casting ever.I think we should stop talking anymore about Emilia Perez like it doesnt exist so this is the only way to stop this.",1,15,1,-0.16785714285714284,0.506547619047619
,The Year's Best Musical Is Also One of Its Best Films,"Its pretty wild to think that without its musical elements in the film, Emilia Pérez wouldnt be as great as it is, as this superb opera takes on a very mature cartel crime story that somehow got a touch of musical magic and turn into a masterpiece, and its undeniably a challenging work to not make it awkward or stupid, but the film pulls it off brilliantly, it reminds me of Joker: Folie à Deux, another musical with an unconventional vibe, the differences is Emilia Pérez nailed every single musical elements in the film, in fact, its the strongest aspect of the film added with such a fascinating story filled with incredible performances by all the cast, great musical numbers, and masterful filmmaking, Jacques Audiard has made in my opinion the best musical of the year, and one of the best films of the year, Emilia Pérez is a delightful surprised, and i love it.",10,9,86,0.3610204081632653,0.5890816326530613
,One of the worst musicals ever made,"13 Oscar nominations? Hard to believe. Emilia simply doesnt belong in the same league as Chicago. The songs are forgettable-no clever rhymes, no lasting impact-and the films cultural portrayal feels questionable at best. While the cinematography and performances have their moments, the overall experience is underwhelming and undeserving of such high recognition.The sheer number of nominations raises concerns about the Oscars credibility. Has genuine artistic merit taken a backseat to industry politics and aggressive campaigning? Awards should celebrate excellence, not influence. This feels like another misstep for the Academy.",1,19,2,0.09773809523809525,0.4676530612244898
,A New Classic Movie,"Emilia Pérez is the kind of film that we should watch without knowing anything about the script. I havent even seen the trailer. And what a wonderful experience it was to watch Jacques Audiards film! It has everything to please the viewer: humor, drama, musical scenes and just when we think its over, it offers us 20 minutes of climax at the end, with a plot twist that takes us by surprise! As for the cast, Karla Sofía Gascón emerges as a future screen diva. What a magnificent performance! I hope she is recognized by the Academy with an Oscar. Zoe Saldaña and Selena Gomez complete the female trio with formidable performances, especially in the dance scenes with iconics choreographies. Emília Pérez is already emerging as a new classic movie of contemporary cinema. 10 out of 10!",10,10,100,0.278030303030303,0.44829545454545455
,Audiart is a chauvinistic moron,"This film is the perfect example of what happens when a director is too arrogant to do even the bare minimum of research. Instead of offering a thoughtful or nuanced portrayal of a country, Audiard delivers a lazy, ignorant, and insultingly shallow caricature, driven entirely by his own inflated sense of superiority. The result? A film so full of forced, outdated stereotypes that it feels like satire-except the only real stereotype here is Audiard himself, embodying the worst kind of smug, self-satisfied French arrogance.And then theres the music. If you thought the writing was bad, wait until you hear the lyrics-so atrocious that even a random street musician does better blindfolded. The entire film reeks of pretension, as if Audiard genuinely believes hes too brilliant to need accuracy, depth, or even basic respect for Mexico.Do Parisians actually think their farts smell like flowers? I refuse to believe it, but if anyone were to make the case for it, its this moron director.Emilia is not just a bad film-its an embarrassing display of ignorance, arrogance, and sheer laziness masquerading as artistic vision. I feel sorry for Zoe and Selena who got ripped off by this mess.",1,23,3,-0.03416666666666666,0.6305555555555556
